{"schema_version":2,"scopes":[{"path":"file1.txt","extent":{"kind":"lines","start":1,"end":2}}],"mutation":{"requested":false,"rewritten":false,"spans_touched":0,"anchors_updated":0,"anchors_removed":0,"identities_collapsed":0},"spans":[{"name":"ctx","evidence_revision":"ed33873540e3c4b38d52ee31db3a33b57a2e5b31805a5e1373e68d029beff372","why":null,"overlaps":[{"scope":0,"anchor":{"ordinal":0,"id":"ctx:file1.txt:L1-L2"},"basis":"anchored","location":{"path":"file1.txt","extent":{"kind":"lines","start":1,"end":2}},"intersection":{"kind":"lines","start":1,"end":2}}],"anchors":[{"ordinal":0,"id":"ctx:file1.txt:L1-L2","anchored":{"path":"file1.txt","extent":{"kind":"lines","start":1,"end":2}},"current":{"path":"file1.txt","extent":{"kind":"lines","start":1,"end":2}},"status":{"code":"FRESH"},"source":null,"sources":[]}]}]}
